index,name,artist,release_date,length,popularity,featured_artists
3974,Highway Girl,The Tragically Hip,1987,3.518433333,38,"Meat Puppets, Material Issue, Roger Waters"
3975,I'm On Standby,Grandaddy,2003,3.202883333,22,"The Guess Who, Rustic Overtones, Tim Finn, Bic Runga, Dave Dobbyn"
3976,Lost Together,Blue Rodeo,2001,5.246,43,
3977,Venus,Bananarama,2017,3.810883333,42,"Ozzy Osbourne, The Rolling Stones, King Gizzard & The Lizard Wizard, King Gizzard & The Lizard Wizard"
3978,Water Song,Hot Tuna,1972,5.273766667,47,"Aerosmith, Cream, The Beatles, Brian Eno"
3979,All The Things She Said,t.A.T.u.,2002,3.574,73,
3980,Choir Girl (Αs performed by Cold Chisel),Pop Music Workshop,2017,3.364433333,0,"Various Artists, Various Artists, Party Tyme Karaoke"
3981,Airport Song,Guster,1997,3.408883333,28,"The Watchmen, Soul Asylum, Soul Asylum, Super Furry Animals, Ayreon"
3982,Poundcake,Van Halen,1991,5.361766667,45,The Jesus and Mary Chain
3983,While You See A Chance,Steve Winwood,1980,5.212883333,61,
3984,The Wall,Kansas,1976,4.798883333,42,Southside Johnny And The Asbury Jukes
3985,Soul Kitchen,The Doors,1967,3.55,63,The Beatles
3986,Sister Awake - Remastered,The Tea Party,2015,5.753766667,22,"One Bad Son, Max Webster, Allman Brothers Band, Humble Pie"
3987,Just Like a Pill,P!nk,2001,3.943333333,67,
3988,Cuyahoga,R.E.M.,1986,4.35665,32,"Bryan Adams, Little River Band, Split Enz"
3989,Soul Stripper,AC/DC,1984,6.416883333,41,"Pretenders, Public Image Ltd."
3990,Motörhead,Motörhead,1977,3.1456,51,John Lennon
3991,Change Of Heart,Tom Petty and the Heartbreakers,1982,3.313333333,37,Rush
3992,Psychosocial,Slipknot,2008,4.723333333,70,"Disturbed, System Of A Down, Foster The People, The Strokes, Jet"
3993,Lovin' You Ain't Easy,Michel Pagliaro,2010,2.735283333,34,"Robert Plant, The Hold Steady, My Morning Jacket, Matt Mays, Giant Drag"
3994,Just Looking,Stereophonics,1999,4.219333333,52,"Aaron Neville, The Shangri-Las, Staind"
3995,Crawl,Breaking Benjamin,2009,3.981766667,56,Hollywood Undead
3996,Joey,Concrete Blonde,1990,4.149316667,57,"Gary Moore, The Stone Roses, Aerosmith, The Dead Milkmen"
3997,Safe in New York City,AC/DC,2000,3.9911,50,The Tea Party
3998,It's So Easy,Guns N' Roses,1987,3.356,59,"Bananarama, John Mellencamp, Stone Temple Pilots"
3999,Come Anytime,Hoodoo Gurus,1989,3.330216667,38,Minor Threat
4000,Urban Guerilla - 1996 Remaster,Hawkwind,1972,3.652216667,31,Bruce Springsteen
4001,Let's Shake,Teenage Head,1980,3.037766667,33,"Minor Threat, Forrest, Blondie"
4002,Going for the One - 2003 Remaster,Yes,1977,5.540883333,36,Electric Light Orchestra
4003,Be Quick or Be Dead - 2015 Remaster,Iron Maiden,1992,3.394216667,38,
4004,Good Fortune,PJ Harvey,2000,3.336666667,52,"Various Artists, Modest Mouse, Creed"
4005,Waiting On the World to Change,John Mayer,2006,3.352883333,74,"John Paul Young, The Calling, Coldplay, Daniel Powter"
4006,Time In A Bottle,Jim Croce,1972,2.466,0,Various Artists
4007,He's So Fine - Remastered 2000,The Chiffons,2004,1.875333333,52,Frankie Valli & The Four Seasons
4008,Wishing Well,Free,1973,3.6691,49,
4009,Slow Down - Remastered 2009,The Beatles,1988,2.94755,36,INXS
4010,Heavy,Collective Soul,2006,2.95355,55,A Flock Of Seagulls
4011,A Rainy Night in Soho,The Pogues,1985,4.730433333,50,"Huey Lewis & The News, Gary Moore, Alice Cooper, ZZ Top"
4012,Enough Is Enough - Remastered,April Wine,2002,4.093333333,28,"Anouk, Marcy Playground, Elwood"
4013,The Winner Takes It All,ABBA,1980,4.912216667,59,"Blue Öyster Cult, Ebba Grön, George Thorogood & The Destroyers, Joy Division, Foreigner"
4014,Bye Bye Love,The Cars,1978,4.252666667,49,"Genesis, Jimmy Buffett, Bob Seger, Rainbow, Kansas"
4015,The Last Time - Mono Version,The Rolling Stones,1965,3.69155,52,"Tommy James & The Shondells, Neil Diamond, The Sonics, John Mayall, Led Zeppelin"
4016,What Does It Take,Honeymoon Suite,1986,4.252216667,39,"Spinal Tap, Pretenders, 54-40, Booker T. & the M.G.'s"
4017,Kids (In The Style Of 'Robbie Williams & Kylie Minogue'),Hot Fox Karaoke,2011,4.30605,0,Audio Idols
4018,Night,Bruce Springsteen,1975,3.003766667,45,"Rainbow, Alice Cooper, Ramones"
4019,United States Of Whatever,Liam Lynch,2003,1.520433333,49,"Unwritten Law, Green Day"
4020,July Morning,Uriah Heep,2009,8.762666667,47,"Death Cab for Cutie, Godsmack, Cold Chisel, Birds Of Tokyo"
4021,Brand New Cadillac - Remastered,The Clash,1979,2.137766667,48,
4022,Metal Guru,T. Rex,1972,2.496433333,43,"ZZ Top, Alice Cooper, Eagles"
4023,Bullet In The Head,Rage Against The Machine,1992,5.111333333,59,"Concrete Blonde, Def Leppard"
4024,Screaming Bloody Murder,Sum 41,2011,3.410433333,52,"Jimmy Eat World, Black Light Burns, The Used"
4025,Var e vargen? - Remix 1995,Imperiet,2007,4.55955,44,"Beck, Rush"
4026,So You Say,Clap Clap Riot,2012,3.737766667,3,"La Douche, Hot Fox Karaoke"
4027,Je t'aime moi non plus,Jane Birkin,1969,4.360216667,40,"The Who, The Beatles, lighthouse, Bob Dylan"
4028,100 Years,Five For Fighting,2003,4.076666667,66,"David Gray, Coldplay, The Strokes"
4029,I'm So Sick,Flyleaf,2006,2.931333333,60,Gossip
4030,Dreamer,Ozzy Osbourne,2001,4.748433333,65,"Blur, The Dandy Warhols"
4031,King Of Pain,The Police,1983,4.984,59,
4032,Real World,Matchbox Twenty,1996,3.86155,61,"Marillion, U2, Weezer, Lit, Various Artists"
4033,Nobody's Fault But My Own,Beck,1998,5.03555,31,"Grandaddy, Tom Waits, Olivia Newton-John, The Beautiful South, Supergrass"
4034,Like The Way I Do,Melissa Etheridge,1988,5.40555,58,"White Zombie, Nine Inch Nails, Metallica, AC/DC, Live"
4035,Hello Hooray,Alice Cooper,1973,4.31,37,"The Rolling Stones, Yes, Allman Brothers Band, Stevie Wonder, Jane Birkin"
4036,It's a Heartache,Bonnie Tyler,1978,3.533333333,52,Huey Lewis & The News
4037,Sweet Shop Avengerz - Hi-Fi Mix,bis,1996,4.148,0,"Enuff Z'Nuff, Backyard Babies, Tom Cochrane, Thumb, Cha Cha Cohen"
4038,Open Your Heart,Europe,1984,4.112216667,55,
4039,Woman in Love,Barbra Streisand,1980,3.864,69,"Eric Carmen, Pink Floyd"
4040,"Stone Free - Live In Maui, 1970",Jimi Hendrix,2020,5.736216667,28,"Skyhooks, Sivert Høyem, ORB"
4041,Jungle Boogie,Kool & The Gang,1973,3.108883333,63,
4042,Waffle,Sevendust,1999,3.510433333,47,"Blondie, The Who, R.E.M., Nickelback"
4043,Somebody's out There,Triumph,2010,3.993333333,34,"POLIÇA, Cold, Airbourne, The Godfathers, Theory of a Deadman"
4044,Ophelia - Remastered 2000,The Band,1975,3.546666667,60,"The Clash, KISS, Bob Seger, Elton John, Bruce Springsteen"
4045,Not Ready to Make Nice,The Chicks,2006,3.954933333,64,"Amy Winehouse, Paramore, Enrique Iglesias, Edward Sharpe & The Magnetic Zeros, Roxy Music"
4046,Mixed Emotions,The Rolling Stones,1989,4.6351,45,"Queensrÿche, Stone Temple Pilots, Aerosmith, Hüsker Dü"
4047,El Scorcho,Weezer,1996,4.057766667,55,The Rolling Stones
4048,A Lover's Question,Clyde McPhatter,2005,2.504433333,38,"Robert Plant, Seven Mary Three, Bonnie ""Prince"" Billy"
4049,No Regrets - Remastered,Tom Cochrane,1991,4.652433333,36,Alice Cooper
4050,Come Together,Spiritualized,1997,4.676216667,40,"Phantom Planet, Wilco"
4051,Breaking All The House Rules,Budgie,2019,6.50555,3,"Various Artists, Kamikaze Palm Tree"
4052,You Belong To The City,Glenn Frey,2018,5.879333333,51,"The Clash, The Clash"
4053,Boredom - Demo,Buzzcocks,1997,2.994,34,"Liquid Liquid, Blur, Finch, Superdrag"
4054,Sound of Madness,Shinedown,2008,3.899766667,66,"Amy Winehouse, Finger Eleven, The Killers, Cage The Elephant, Linkin Park"
4055,Red Rain - 2012 Remaster,Peter Gabriel,1986,5.674883333,40,
4056,Thing Called Love,Bonnie Raitt,1989,3.868883333,40,Depeche Mode
4057,"Teacher, Teacher",38 Special,1987,3.252216667,32,They Might Be Giants
4058,Here and Now,Letters To Cleo,1994,3.64355,45,Metallica
4059,It's Time,Imagine Dragons,2012,3.966433333,68,"Rise Against, Sara Bareilles, Disturbed"
4060,Of Wolf And Man,Metallica,1991,4.27555,57,"TOOL, The Presidents Of The United States Of America, Aerosmith, Saint Etienne"
4061,High Class In Borrowed Shoes,Max Webster,2017,4.0251,14,The Tea Party
4062,Abuse Me,Silverchair,1997,3.998216667,44,"Nickelback, the feelers"
4063,Poets,The Tragically Hip,1998,3.990433333,47,"Faith No More, Godsmack"
4064,The Fool On The Hill - Remastered 2009,The Beatles,1967,2.9851,57,Black Sabbath
4065,What Do I Have to Do?,Stabbing Westward,1994,4.116,41,Lake Of Tears
4066,Yellow Submarine - Remastered 2009,The Beatles,1966,2.648,64,"The Rolling Stones, Joni Mitchell, The Velvet Underground"
4067,Turn The Lights On,Big Sugar,2018,3.907766667,26,"Players Since Creation, King Gizzard & The Lizard Wizard, Elvis Presley, Guano Apes"
4068,Hickory Wind - Alternate Version,Gram Parsons,2006,4.2531,25,
4069,Smile,Atomic Swing,1998,4.456666667,32,"Eve 6, Puddle Of Mudd, Sam Roberts Band, Ebba Grön, Sex Pistols"
4070,Highway Song,Blackfoot,1979,7.50555,52,"ICEHOUSE, Rush, Neil Young, Mi-Sex, Rush"
4071,Junior’s Farm,Wings,1978,4.392666667,36,"The Clash, KISS"
4072,"You Know My Name - From ""Casino Royale"" Soundtrack",Chris Cornell,2007,4.002,60,
4073,Lady in Black,Uriah Heep,2009,5.51,35,"Ray Charles, Weezer, Various Artists, Sweet"
4074,Catch The Sun,Doves,2000,4.827766667,42,
4075,Stiff Upper Lip,AC/DC,2000,3.576,63,
4076,Born Under A Bad Sign,Cream,1968,3.157333333,44,"The Beatles, Bob Dylan, The Beatles"
4077,Too Much Ain't Enough Love - Live,Jimmy Barnes,1988,6.053333333,14,"Clawfinger, Pat Travers"
4078,So Beautiful - Single Version,Pete Murray,2003,4.658666667,54,"Coldplay, Boards of Canada, Radiohead, Tegan and Sara, Rise Against"
4079,Love Walked In,Thunder,1990,6.423333333,49,"Rage Against The Machine, Melissa Etheridge, Nine Inch Nails, Various Artists, Stevie Ray Vaughan"
4080,Ball and Biscuit,The White Stripes,2003,7.316,34,
4081,Blood Of Emeralds,Gary Moore,1989,8.326666667,19,"Chilliwack, Oasis, The Exponents, Lillian Axe, XTC"
4082,Stand Back,Stevie Nicks,1991,4.95155,57,"Queen, Ebba Grön, They Might Be Giants, TOOL"
4083,Pass It On,The Coral,2003,2.318883333,52,Phantom Planet
4084,Captain Fantastic And The Brown Dirt Cowboy,Elton John,1975,5.772666667,51,"Crosby, Stills, Nash & Young, David Gilmour, Stevie Wonder, Kenny Loggins"
4085,Creatures (For a While),311,2003,4.408216667,39,"The Band, The Tea Party, In Flames, Billy Talent, Dead Kennedys"
4086,Stranded,Heart,1990,3.980433333,39,"Grateful Dead, ZZ Top, Bon Jovi, Jimmy Buffett, George Harrison"
4087,Everybody's Fool,Evanescence,2003,3.264666667,64,"OneRepublic, Velvet Revolver"
4088,All Things Must Pass - Remastered 2014,George Harrison,1970,3.7811,59,
4089,Take A Long Line - Live,The Angels,2011,4.83555,24,
4090,Too Young To Fall In Love,Mötley Crüe,1983,3.544216667,56,
4091,The Last Resort - 2013 Remaster,Eagles,1976,7.415183333,56,
4092,Big Ten Inch Record,Aerosmith,1975,2.256666667,46,
4093,Blind Man,Black Stone Cherry,2008,3.6411,33,"The Hellacopters, Sick Puppies, Big Sugar, Starsailor, Daughtry"
4094,Life in a Northern Town,The Dream Academy,1985,4.32155,54,"Various Artists, Tom Waits, REO Speedwagon"
4095,Desperately Wanting,Better Than Ezra,1996,4.624883333,54,"R.E.M., Primal Scream, Tantric"
4096,A Mess of Blues,Elvis Presley,1968,2.684433333,49,"The Doors, Billy Joel, Bill Haley & His Comets, Lou Reed"
4097,The Carpenter - Live,Nightwish,2019,6.121333333,32,"King Gizzard & The Lizard Wizard, Bad Company, ShitKid, Big Sugar"
4098,Hole in the Sky,Black Sabbath,1975,4.003766667,44,"Heart, Blondie, The Hollies"
4099,Persephone,Wishbone Ash,1974,6.978666667,37,"Harry Chapin, Jane Birkin"
4100,Christine’s Tune,The Flying Burrito Brothers,1969,3.04555,37,Roxy Music
4101,Shout To The Top - USA Remix,The Style Council,1985,4.291333333,55,"Eric Clapton, Stevie Ray Vaughan, Aerosmith, The Smiths"
4102,Her Strut,Bob Seger,1980,3.8891,51,"New Order, Bryan Adams, Pete Townshend, Rush, Led Zeppelin"
4103,My Guitar Lies Bleeding In My Arms,Bon Jovi,1995,5.698216667,37,Various Artists
4104,Parents,Budgie,2019,10.32666667,15,
4105,2-4-6-8 Motorway,Tom Robinson Band,1978,3.298883333,52,"Billy Joel, Violent Femmes, Todd Rundgren, The Babys, Mi-Sex"
4106,"I Can't Help Myself (Sugar Pie, Honey Bunch)",Four Tops,1965,2.671333333,72,"The Mamas & The Papas, Creedence Clearwater Revival, Santana, The Band"
4107,Pictures of Matchstick Men - Mono Version,Status Quo,1968,3.176666667,53,"Bob Dylan, The Beach Boys, Elton John"
4108,Private Eyes,Daryl Hall & John Oates,1981,3.62,64,
4109,Love Song,Sara Bareilles,2007,4.313766667,75,Billy Talent
4110,You Can Leave Your Hat On,Joe Cocker,1986,4.254883333,59,"Tom Tom Club, Various Artists, Tina Turner, Fine Young Cannibals"
4111,Looks That Kill,Mötley Crüe,1983,4.150216667,62,The Replacements
4112,In Joy And Sorrow,HIM,2001,3.982666667,39,"Bee Gees, The White Stripes, Super Furry Animals"
4113,Parabola,TOOL,2001,6.061333333,62,"The Goo Goo Dolls, Rammstein, P.O.D."
4114,Unskinny Bop,Various Artists,2020,3.8011,6,"The Darkness, Cold Chisel"
4115,Steal My Sunshine,LEN,1999,4.42555,43,"Alice In Chains, Muse"
4116,Over My Head,Fleetwood Mac,1975,3.577766667,58,Genesis
4117,Race for the Prize - 2017 Remaster,The Flaming Lips,1999,4.3152,57,"Beastie Boys, R.E.M., The Used"
4118,Sex & Drugs & Rock & Roll,Ian Dury,1977,3.110433333,51,
4119,My Country,Midnight Oil,1993,4.852883333,30,"Anouk, The Tragically Hip, Mitch Ryder and The Detroit Wheels, Crash Test Dummies, Various Artists"
4120,Blue,Joni Mitchell,1971,2.954216667,50,
4121,Mercury Blues,David Lindley,1981,3.537333333,43,"Foreigner, The Stranglers, Blondie, Mental As Anything"
4122,Doom And Gloom,The Rolling Stones,2019,3.975766667,50,Five Finger Death Punch
4123,Crying in the Rain - 1987 Version; 2018 Remaster,Whitesnake,1987,5.627283333,41,"Robert Plant, John Mellencamp, Bryan Adams, The Associates"
4124,The Greatest View,Silverchair,2002,4.04955,40,
4125,Push,Moist,1994,3.840433333,26,Sleater-Kinney
4126,"Once Bitten, Twice Shy",Various Artists,2010,4.724433333,32,Crowded House
4127,I Wanna Go Home,Sator,1992,3.711766667,46,"Edie Brickell & New Bohemians, ZZ Top, Material Issue, April Wine"
4128,Say Goodbye to Hollywood,Billy Joel,1976,4.60555,48,"Foghat, The Moody Blues, Led Zeppelin"
4129,"Get Outta My Dreams, Get Into My Car",Billy Ocean,2010,4.73955,64,"The Script, Thirty Seconds To Mars"
4130,"Thank You - Live In Stockholm, Sweden/2006",Chris Cornell,2018,4.4591,38,"Emerson, Lake & Palmer"
4131,L Train,Shootyz Groove,1999,3.8611,15,
4132,All Fired Up,Pat Benatar,1988,4.536666667,54,"Guns N' Roses, Anthrax, Metallica"
4133,Victim of Changes,Judas Priest,1993,7.175333333,28,"Talking Heads, Dave Matthews Band, Teenage Fanclub, Liz Phair, Bon Jovi"
4134,Empty Garden (Hey Hey Johnny) - Remastered 2003,Elton John,1982,5.136666667,46,
4135,Valerie,Steve Winwood,1982,4.1111,66,
4136,Acquiesce,Oasis,1998,4.416,56,"Counting Crows, Powerman 5000, The Distillers, Dropkick Murphys"
4137,Shake a Leg,AC/DC,1980,4.094433333,56,"Led Zeppelin, Dio, KC & The Sunshine Band"
4138,Showgirl,Luke Haines,2003,4.270616667,9,"Foo Fighters, Mr. Mister, Starlight Mints, Stevie Wonder, Army of Anyone"
4139,Everything You Want,Vertical Horizon,1999,4.284433333,64,Petula Clark
4140,Every Time I Think of You,The Babys,1978,3.986,49,"Grateful Dead, The Police, Steely Dan"
4141,Apologize,OneRepublic,2007,3.468433333,73,"The Kingsmen, The Strokes, Kelly Clarkson, The Goo Goo Dolls"
4142,Dancing in the Street - Steve Thompson Mix,David Bowie,1985,4.71555,29,"The Associates, Ebba Grön"
4143,Bourée,Jethro Tull,1977,3.7751,53,"Bruce Springsteen, Supertramp"
4144,What Lies Beneath,Breaking Benjamin,2009,3.579766667,55,
4145,Wake up Boo!,The Boo Radleys,1995,3.6311,51,"Yes, Korn, Weezer, The Flaming Lips, Fenix TX"
4146,Gold,Spandau Ballet,2000,3.858,67,"Korn, Blur, Red Hot Chili Peppers, Dashboard Confessional"
4147,Something's Always Wrong,Toad The Wet Sprocket,1994,4.948883333,47,"Bush, The Nixons, Garbage, The Black Crowes"
4148,Daydreamer,Menswear,1995,2.276216667,31,"Kim Mitchell, Ben Folds Five, Teenage Fanclub"
4149,It's Now or Never,Elvis Presley,2002,3.243333333,60,
4150,Little Wing,Stevie Ray Vaughan,1984,6.808,61,"Soft Cell, Pixies, Queen, The Smiths"
4151,It Ain't Over Till It's Over,Relaxing Piano Covers,2015,4.818066667,1,"Molotov Cocktail Piano, Various Artists"
4152,Alright,Supergrass,1995,3.014666667,72,
4153,Fire,Kasabian,2009,4.20465,66,Gnarls Barkley
4154,Famous Last Words,My Chemical Romance,2006,4.9871,71,Puddle Of Mudd
4155,Lager & Ale,Kim Mitchell,1995,3.271766667,33,"Oasis, Iron Maiden, The Tragically Hip, Staind, Head Like A Hole"
4156,Professional Widow - Merry Widow Version,Tori Amos,1996,4.65,31,The Ink Spots
4157,Again,Alice In Chains,1995,4.083333333,51,"Stabbing Westward, Faith No More, Live"
4158,Human Fly,The Cramps,1983,2.273766667,56,"Joy Division, Guns N' Roses, The Replacements"
4159,This Is It,Kenny Loggins,1979,3.94555,55,Wreckless Eric
4160,I Touch Myself,Divinyls,1991,3.794,63,Dream Theater
4161,Holiday,Nazareth,1980,3.604216667,29,
4162,St. Elmos Fire (Man in Motion),Various Artists,1985,4.196666667,68,Joe Cocker
4163,Only God Knows Why,Kid Rock,1998,5.4611,62,"The Champs, Red Hot Chili Peppers"
4164,Song For The Lonely,The Living End,2011,3.218666667,21,"Chickenfoot, Hot Hot Heat"
4165,When Will I Be Loved,Linda Ronstadt,1974,2.0811,58,"Crosby, Stills, Nash & Young, Wreckless Eric"
4166,"Lovin', Touchin', Squeezin'",Journey,1979,3.842216667,60,"Queen, Prince, Dire Straits, Genesis"
4167,Minus Celsius,Backyard Babies,2003,3.574433333,44,"Rise Against, Angels & Airwaves, Breaking Benjamin, Rilo Kiley"
4168,Sittin' In The Balcony,Eddie Cochran,1957,2.000433333,27,
4169,38 Years Old,The Tragically Hip,2005,4.32555,41,
4170,Jealous Guy - Remastered,Roxy Music,2001,4.9551,59,"Marcy Playground, Jet"
4171,Tiny Spark,Brendan Benson,2009,3.2291,33,"Poe, Maximo Park, Nine Inch Nails, Freddy Cannon"
4172,If You Want My Love,Cheap Trick,1982,3.595333333,45,"Styx, Santana, Crowded House, Squeeze, Elvis Costello & The Attractions"
4173,Say (All I Need),OneRepublic,2007,3.842883333,47,"Starsailor, Green Day, Lacuna Coil"
4174,Season of the Witch,Donovan,1966,4.898883333,64,"The Doors, The Beatles, Janis Joplin"
4175,This Means War,Nickelback,2011,3.344433333,54,"Stone Sour, Three Days Grace, Arctic Monkeys, Three Days Grace"
4176,House of Pain,Faster Pussycat,1989,5.7771,54,"Hole, Firehouse, Melissa Etheridge, Indigo Girls"
4177,Human Touch,Bruce Springsteen,1992,6.48,61,"Elvis Presley, Bush, Firehouse, Radiohead"
4178,I Am One - Remastered 2011,The Smashing Pumpkins,1991,4.114216667,40,
4179,The Nips Are Getting Bigger,Mental As Anything,1979,3.346666667,36,"Bad Brains, Wings, Alice Cooper"
4180,"Hail, Hail",Pearl Jam,1996,3.685766667,50,"Supergrass, Muse, Sevendust, Jimmie's Chicken Shack, Soul Asylum"
4181,If That's What It Takes,Bon Jovi,1995,5.283333333,36,
4182,I'm Coming Out,Diana Ross,1980,5.4211,67,"AC/DC, Molly Hatchet"
4183,Gloria - Live; 2007 Remaster,The Doors,2007,6.308,52,"Lucinda Williams, Dawes"
4184,Xanadu - Composed Or Made Famous By: Olivia Newton-John & Electric Light Orchestra,Stingray Music (Karaoke),2009,3.416383333,1,"Studio Allstars, La Douche"
4185,Love Interruption,Jack White,2016,2.622666667,25,
4186,Pain Killer (Summer Rain),Turin Brakes,2003,3.932216667,21,"Black Rebel Motorcycle Club, Long John Baldry, Fuel, The Killers, Patti Smith"
4187,"Black Fingernails, Red Wine",Eskimo Joe,2006,4.164433333,31,Finch
4188,Summer Rain,Belinda Carlisle,1989,5.544216667,49,"Pearl Jam, Beastie Boys"
4189,Fat Man in the Bathtub,Little Feat,1973,4.528216667,49,"Bachman-Turner Overdrive, Pink Floyd, Billy Joel, Flamin' Groovies"
4190,Swagger of Thieves,Head Like A Hole,2011,3.774266667,16,"Prince, Jimmy Barnes"
4191,White Unicorn,Wolfmother,2005,5.027766667,39,"Grateful Dead, Cold, Kings of Leon"
4192,Meet Me on the Equinox,Various Artists,2009,3.73555,48,"Thirty Seconds To Mars, The Soup Dragons"
4193,Thorn In My Pride,The Black Crowes,1992,6.064883333,47,"Beastie Boys, Alice Cooper, April Wine"
4194,Where To Now St. Peter? - Remastered 2017,Elton John,2020,4.2271,35,Nirvana
4195,The Fly,U2,1991,4.484216667,49,Peter Gabriel
4196,Who Knew,P!nk,2006,3.474883333,68,"Billy Idol, Snow Patrol, Red Hot Chili Peppers, Daniel Powter"
4197,Stay Together For The Kids,blink-182,2001,3.988883333,63,Breaking Benjamin
4198,If I Could Turn Back Time,Cher,1989,3.9971,72,"Nirvana, Guns N' Roses, Pearl Jam, Mr. Mister"
4199,Bye Bye Johnny,Return,1988,4.183333333,49,"Phil Collins, Dead Kennedys, John Mellencamp, Def Leppard, The Cure"
4200,The Color of the Night (Made Popular By Lauren Christy) [Vocal Version],Party Tyme Karaoke,2020,4.0933,3,"Various Artists, Fairport Convention"
4201,Consoler Of The Lonely,The Raconteurs,2008,3.426433333,47,
4202,The Rocker,Thin Lizzy,1973,5.2551,42,"Black Sabbath, George Harrison, KISS"
4203,Why'd You Lie?,Colin James,1988,5.468883333,27,"Gary Moore, Blue Cheer, Lenny Kravitz"
4204,Gamma Ray,Beck,2008,2.948666667,47,"Triumph, The Soup Dragons, Puddle Of Mudd, The Gaslight Anthem"
4205,Shelter Me,Cinderella,1990,4.7971,47,
4206,Skydiver,Schtum,1996,3.362,12,"Tonic, The Shamen, Public Image Ltd., Death In Vegas, Shihad"
4207,Toys And Flavors,The Hellacopters,2000,3.541766667,42,"Finch, AC/DC, The Used, Orgy"
4208,Uptown Girl,Billy Joel,1983,3.2951,77,
4209,Chalk Outline,Three Days Grace,2012,3.0331,60,
4210,Time Machine,Grand Funk Railroad,2006,3.756216667,31,"The Tragically Hip, Black Rebel Motorcycle Club, Grandaddy, The White Stripes"
4211,To Cut a Long Story Short - 2010 Remaster,Spandau Ballet,1981,3.328216667,30,Ebba Grön
4212,Feel the Pain,Dinosaur Jr.,1994,4.326666667,62,"Modest Mouse, Collective Soul"
4213,Broken Wings,Mr. Mister,1985,5.732216667,70,"John Mellencamp, The Cure, The Church"
4214,Chance,Big Country,1983,4.446,42,The Dead Milkmen
4215,Calling Dr. Love,KISS,1976,3.744433333,52,"Led Zeppelin, Bryan Ferry, The Damned"
4216,A Groovy Kind of Love,Phil Collins,2004,3.512216667,65,"The Temptations, Red Hot Chili Peppers, The Avett Brothers"
4217,Hurricane,Theory of a Deadman,2011,4.290883333,46,"Keane, Mudhoney, The Shins"
4218,"The Story of the Blues, Pt. 1",The Mighty Wah!,2020,3.6811,39,"King Gizzard & The Lizard Wizard, King Gizzard & The Lizard Wizard, Various Artists"
4219,Beating Around the Bush,AC/DC,1979,3.928433333,51,
4220,Driving Away From Home (Jim's Tune),It's Immaterial,1986,4.218883333,43,"The Motels, D-A-D, Stevie Ray Vaughan, The Replacements, Mr. Big"
4221,Don't Try to Lay No Boogie-Woogie on the King of Rock and Roll - Remastered,Long John Baldry,2007,3.42555,16,"The Fratellis, Various Artists, Jeremiah Freed"
4222,Bird of Paradise,Snowy White,2003,4.6911,56,"GANGgajang, Pixies, Red Hot Chili Peppers"
4223,You Shook Me - 1993 Remaster,Led Zeppelin,1969,6.468216667,53,Jethro Tull
4224,Nantucket Sleighride,Leslie West,2013,5.952433333,36,
4225,Upside Down,Diana Ross,1980,4.080433333,66,"The Jam, U2, Prince"
4226,This Corrosion,Various Artists,2019,4.477766667,21,
4227,Everybody Talks,Neon Trees,2012,2.954666667,65,"The Airborne Toxic Event, Three Days Grace"
4228,The New Pollution,Beck,1996,3.658433333,39,
4229,Love Is All,Roger Glover,1974,3.287766667,47,"AC/DC, Bruce Springsteen"
4230,Slave To Love,Bryan Ferry,1985,4.438883333,67,"Sonic Youth, Men At Work, The Greg Kihn Band, Def Leppard, Dio"
4231,Satisfaction Guaranteed,The Firm,1985,4.174,42,
4232,A Salty Dog,Procol Harum,1969,4.658433333,21,
4233,Wouldn't It Be Good,Various Artists,2018,4.61755,44,"Bertie Higgins, King Gizzard & The Lizard Wizard, Katori Walker, The Beta Band"
4234,Just a Job to Do - 2007 Remaster,Genesis,1983,4.787766667,36,"Whitesnake, Bruce Springsteen"
4235,Until the Day I Die,Story Of The Year,2003,3.92,66,"Keane, Disturbed, Linkin Park"
4236,I'm Awesome,Spose,2010,4.152433333,24,
4237,Lesson Learned,Alice In Chains,2009,4.27955,33,"Van Halen, The Monroes, Velvet Revolver, Hollerado"
4238,Rev It Up,Jerry Harrison,1988,4.1911,27,"Echo & the Bunnymen, Little River Band, Primal Scream"
4239,Falling to Pieces,Faith No More,1989,5.226216667,51,
4240,Sarah - Version 3,Thin Lizzy,1979,3.500666667,44,"Ebba Grön, Styx"
4241,Just Like Paradise,David Lee Roth,1988,4.054666667,57,"Eurythmics, Suicidal Tendencies"
4242,It's Only Make Believe,Conway Twitty,1959,2.200433333,53,"Elvis Presley, The Beatles"
4243,Going Out,Supergrass,1997,4.2811,30,"Starsailor, The Guess Who, The Specials"
4244,Ship of Fools - 2006 Remaster,Robert Plant,2007,5.009766667,45,Local H
4245,Sleeping With The Lights On (In The Style of Busted),Ameritz Audio Karaoke,2011,3.63865,0,"Cardio Workout Crew, The Crazy Horses"
4246,Livet är en fest,Nationalteatern,1974,4.230433333,47,"Trooper, The Who, Elvis Costello & The Attractions, Steve Miller Band"
4247,You Wouldn't Believe,311,2001,3.7051,39,"Grand Funk Railroad, Hundred Reasons, The Tragically Hip, Sevendust"
4248,Last of the American Girls,Green Day,2009,3.850433333,54,"Arcade Fire, The Black Keys, Gossip, Bon Jovi"
4249,Room To Move,John Mayall,1969,5.034216667,46,"The Rolling Stones, The Rolling Stones, The Rolling Stones"
4250,Dog & Butterfly,Heart,1978,5.32555,42,
4251,All The Same,Sick Puppies,2007,4.309766667,54,"A Perfect Circle, The Airborne Toxic Event, Gary Clark Jr., Lynyrd Skynyrd, Sponge"
4252,Meet Virginia,Train,1998,3.998883333,65,"Ozzy Osbourne, Coldplay, Nick Cave & The Bad Seeds"
4253,Nobody,Skindred,2004,3.9319,59,blink-182
4254,Closer,Kings of Leon,2008,3.958,66,"Nickelback, Red Hot Chili Peppers"
4255,Mamma pappa barn,Ebba Grön,1981,3.050216667,40,"The Clash, R.E.M."
4256,Caught Up In You,38 Special,1982,4.65555,64,"Lionel Richie, Steve Miller Band"
4257,(I Know) I'm Losing You,Rod Stewart,1971,5.39555,40,"The Monks, Neil Young, Aerosmith"
4258,Playing To Win - Remastered 2010,Little River Band,1984,2.985333333,39,"Def Leppard, Saxon"
4259,Father To Son - Remastered 2011,Queen,1974,6.230883333,36,"The Rascals, Stevie Wonder, Yes"
4260,Silent Sigh,Badly Drawn Boy,2002,4.7451,51,"David Gray, A Perfect Circle"
4261,Baby Hold On,Eddie Money,1977,3.513766667,58,"Warren Zevon, Rainbow, Grateful Dead, The Slits"
